### ISSUE TITLE
Why is the script such aggressive and tries to get the evse stats 5...6 times each second?

### ISSUE THREAD

**Issue by pzystorm** [JFK344/ioBroker.evsewifi#11]
**Describe the bug**  
I did a tcpdump while the adapter is running and there are thousands of lines. A small passage looks like this:

00:54:49.803881 IP 192.168.0.10.42522 > 192.168.0.12.80: Flags [P.], seq 0:74, ack 1, win 29200, length 74
....GET /getParameters HTTP/1.1....

00:54:49.932085 IP 192.168.0.10.42524 > 192.168.0.12.80: Flags [P.], seq 0:74, ack 1, win 29200, length 74
....GET /getParameters HTTP/1.1....

00:54:50.028123 IP 192.168.0.10.42514 > 192.168.0.12.80: Flags [P.], seq 0:74, ack 1, win 29200, length 74
....GET /getParameters HTTP/1.1....

00:54:50.188138 IP 192.168.0.10.42508 > 192.168.0.12.80: Flags [P.], seq 0:74, ack 1, win 29200, length 74
....GET /getParameters HTTP/1.1....

So, when you look at the timings, each 0.1 to 0.2sec there is a call to the evse's /getParameters page.

**To Reproduce**  
1. Enable the ioBroker.evsewifi module in iobroker
2. Make a tcpdump on the OS where iobroker is running 

**Expected behavior**  
I think one request each 10 sec (or even one request each minute) should be enough.

**Versions:**  
 - Adapter version: 1.0.0
 - JS-Controller version: 4.0.23
 - Node version: v14.20.1
 - Operating system: Synology DSM 6 --> Docker version 18.09.8, build bfed4f5 --> Debian 11 Image

**Comment by pzystorm** [comment]
Ah, solved.
FYI: you MUST specify a "Refresh Interval" > 0 in the settings page of the evsewifi instance. Do not leave it blank or enter 0, because then you will have the aggressive behaviour as described above.
I have entered "30" in that field.
